{
  "id": "oc-03-red-zone",
  "situation": {
    "role": "OC",
    "offense": "SF",
    "defense": "SEA",
    "season": 2026,
    "down": 2,
    "distance": 6,
    "yardline_100": 12,
    "quarter": 3,
    "clock_seconds": 400,
    "score_diff": 3,
    "timeouts_offense": 3,
    "timeouts_defense": 3
  },
  "data": "fixtures",
  "acceptable_play_families": [
    "inside_run",
    "outside_run",
    "quick_pass",
    "play_action"
  ],
  "unacceptable_play_families": [
    "punt",
    "field_goal",
    "sneak"
  ],
  "acceptable_pressures": null,
  "unacceptable_pressures": null,
  "acceptable_coverage_shells": null,
  "acceptable_fronts": null,
  "notes_for_human_rater": "2nd & 6 at the 12. Compressed field: runs, quick game, and play-action are all defensible; kicking on 2nd down is not."
}
